<?xml version="1.0" ?>
<UiLayout xmlns="http://www.w3schools.com/Ui" xmlns:xsi="http://www.w3.org/2001/XMLSchema-instance" xsi:schemaLocation="http://www.w3schools.com/Ui.xsd file:///F:/mmo/data/client/Interface/Ui.xsd">
	<Script file="AuraBar.lua" />

    <Frame name="AuraBar" parent="GameParent">
        <!-- Right offset keeps the aura rows clear of the whole top-right HUD column, not just
             the minimap: the quest tracker hangs below the minimap but is 560 wide (QuestTracker.xml),
             so it reaches further left than the 384 wide minimap. With the minimap collapsed the
             tracker rises next to the aura rows, and a smaller offset would put its heading on top
             of the first buff's duration label. 24 (tracker margin) + 560 (tracker) + 8 (gap) = 592. -->
        <Area>
			<Anchor point="TOP" offset="8" />
			<Anchor point="RIGHT" offset="-592" />
            <Size>
                <AbsDimension x="1024" y="256" />
            </Size>
        </Area>

        <!-- Buff (Positive Aura) Row -->
        <Frame name="BuffButton1" inherits="AuraBarButtonTemplate" id="1">
            <Area>
                <Anchor point="RIGHT" offset="0" />
                <Anchor point="TOP" offset="0" />
            </Area>
        </Frame>
        
        <Frame name="BuffButton2" inherits="AuraBarButtonTemplate" id="2">
            <Area>
                <Anchor point="RIGHT" relativeTo="BuffButton1" relativePoint="LEFT" offset="0" />
                <Anchor point="TOP" offset="0" />
            </Area>
        </Frame>
        
        <Frame name="BuffButton3" inherits="AuraBarButtonTemplate" id="3">
            <Area>
                <Anchor point="RIGHT" relativeTo="BuffButton2" relativePoint="LEFT" offset="0" />
                <Anchor point="TOP" offset="0" />
            </Area>
        </Frame>
        
        <Frame name="BuffButton4" inherits="AuraBarButtonTemplate" id="4">
            <Area>
                <Anchor point="RIGHT" relativeTo="BuffButton3" relativePoint="LEFT" offset="0" />
                <Anchor point="TOP" offset="0" />
            </Area>
        </Frame>
        
        <Frame name="BuffButton5" inherits="AuraBarButtonTemplate" id="5">
            <Area>
                <Anchor point="RIGHT" relativeTo="BuffButton4" relativePoint="LEFT" offset="0" />
                <Anchor point="TOP" offset="0" />
            </Area>
        </Frame>
        
        <Frame name="BuffButton6" inherits="AuraBarButtonTemplate" id="6">
            <Area>
                <Anchor point="RIGHT" relativeTo="BuffButton5" relativePoint="LEFT" offset="0" />
                <Anchor point="TOP" offset="0" />
            </Area>
        </Frame>
        
        <Frame name="BuffButton7" inherits="AuraBarButtonTemplate" id="7">
            <Area>
                <Anchor point="RIGHT" relativeTo="BuffButton6" relativePoint="LEFT" offset="0" />
                <Anchor point="TOP" offset="0" />
            </Area>
        </Frame>
        
        <Frame name="BuffButton8" inherits="AuraBarButtonTemplate" id="8">
            <Area>
                <Anchor point="RIGHT" relativeTo="BuffButton7" relativePoint="LEFT" offset="0" />
                <Anchor point="TOP" offset="0" />
            </Area>
        </Frame>

        <!-- Debuff (Negative Aura) Row -->
        <Frame name="DebuffButton1" inherits="AuraBarButtonTemplate" id="9">
            <Area>
                <Anchor point="RIGHT" offset="0" />
                <Anchor point="TOP" offset="164" />
            </Area>
        </Frame>
        
        <Frame name="DebuffButton2" inherits="AuraBarButtonTemplate" id="10">
            <Area>
                <Anchor point="RIGHT" relativeTo="DebuffButton1" relativePoint="LEFT" offset="0" />
                <Anchor point="TOP" offset="164" />
            </Area>
        </Frame>
        
        <Frame name="DebuffButton3" inherits="AuraBarButtonTemplate" id="11">
            <Area>
                <Anchor point="RIGHT" relativeTo="DebuffButton2" relativePoint="LEFT" offset="0" />
                <Anchor point="TOP" offset="164" />
            </Area>
        </Frame>
        
        <Frame name="DebuffButton4" inherits="AuraBarButtonTemplate" id="12">
            <Area>
                <Anchor point="RIGHT" relativeTo="DebuffButton3" relativePoint="LEFT" offset="0" />
                <Anchor point="TOP" offset="164" />
            </Area>
        </Frame>
        
        <Frame name="DebuffButton5" inherits="AuraBarButtonTemplate" id="13">
            <Area>
                <Anchor point="RIGHT" relativeTo="DebuffButton4" relativePoint="LEFT" offset="0" />
                <Anchor point="TOP" offset="164" />
            </Area>
        </Frame>
        
        <Frame name="DebuffButton6" inherits="AuraBarButtonTemplate" id="14">
            <Area>
                <Anchor point="RIGHT" relativeTo="DebuffButton5" relativePoint="LEFT" offset="0" />
                <Anchor point="TOP" offset="164" />
            </Area>
        </Frame>
        
        <Frame name="DebuffButton7" inherits="AuraBarButtonTemplate" id="15">
            <Area>
                <Anchor point="RIGHT" relativeTo="DebuffButton6" relativePoint="LEFT" offset="0" />
                <Anchor point="TOP" offset="164" />
            </Area>
        </Frame>
        
        <Frame name="DebuffButton8" inherits="AuraBarButtonTemplate" id="16">
            <Area>
                <Anchor point="RIGHT" relativeTo="DebuffButton7" relativePoint="LEFT" offset="0" />
                <Anchor point="TOP" offset="164" />
            </Area>
        </Frame>

        <Scripts>
            <OnLoad>
                return function(this)
                    AuraBar_OnLoad(this);
                end
            </OnLoad>
        </Scripts>
    </Frame>
    
</UiLayout>
