<?xml version="1.0" ?>
<UiLayout xmlns="http://www.w3schools.com/Ui" xmlns:xsi="http://www.w3.org/2001/XMLSchema-instance" xsi:schemaLocation="http://www.w3schools.com/Ui.xsd file:///F:/mmo/data/client/Interface/Ui.xsd">
	<Script file="ZoneText.lua" />

    <Font name="ZoneTextFont" file="Fonts/FRIZQT__.TTF" size="64" outline="3" />
    <Font name="ZoneTextFontSmall" file="Fonts/FRIZQT__.TTF" size="48" outline="3" />
	
    <Frame name="ZoneText" inherits="TextSmall" parent="GameParent">
        <Property name="MousePassThrough" value="true" />
        <Property name="Font" value="ZoneTextFont" />
		<Property name="HorzAlign" value="CENTER" />
		<Property name="TextColor" value="FF19FF19" />

		<Area>
			<Size>
				<AbsDimension y="96" />
				<Anchor point="LEFT" />
                <Anchor point="RIGHT" />
				<Anchor point="V_CENTER" offset="-256" />
			</Size>
		</Area>

		<Scripts>
			<OnLoad>
				return function(this)
					ZoneText_OnLoad(ZoneText);
				end
			</OnLoad>
            <OnUpdate>
                return function(this, elapsed)
                    ZoneText_OnUpdate(ZoneText, elapsed);
                end
            </OnUpdate>
		</Scripts>
    </Frame>
    <Frame name="ZoneSubText" inherits="TextSmall" parent="GameParent">
        <Property name="MousePassThrough" value="true" />
        <Property name="Font" value="ZoneTextFontSmall" />
		<Property name="HorzAlign" value="CENTER" />
		<Property name="TextColor" value="FF19FF19" />

		<Area>
			<Size>
				<AbsDimension y="64" />
				<Anchor point="LEFT" />
                <Anchor point="RIGHT" />
				<Anchor point="TOP" relativePoint="BOTTOM" relativeTo="ZoneText" />
			</Size>
		</Area>

		<Scripts>
			<OnLoad>
				return function(this)
					ZoneText_OnLoad(ZoneSubText);
				end
			</OnLoad>
            <OnUpdate>
                return function(this, elapsed)
                    ZoneText_OnUpdate(ZoneSubText, elapsed);
                end
            </OnUpdate>
		</Scripts>
    </Frame>
</UiLayout>
